<!-- Created for the TLOS Scheduler http://www.likyateknoloji.com -->
<alm:alarmManagement xmlns:com="http://www.likyateknoloji.com/XML_common_types" xmlns:state-types="http://www.likyateknoloji.com/state-types" xmlns:sla="http://www.likyateknoloji.com/XML_SLA_types" xmlns:usr="http://www.likyateknoloji.com/XML_user_types" xmlns:alm="http://www.likyateknoloji.com/XML_alarm_types" xmlns:xsi="http://www.w3.org/2001/XMLSchema-instance" xsi:schemaLocation="http://www.likyateknoloji.com/XML_alarm_types xmldb:exist:///db/TLOSSW/xsds/tlosSWAlarm_v_1_0.xsd">
    <alarm xmlns="http://www.likyateknoloji.com/XML_alarm_types" ID="134">
        <alm:name>alarm37</alm:name>
        <alm:desc>Alarm Kaw</alm:desc>
        <alm:alarmType>Job</alm:alarmType>
        <alm:subscriptionType>User</alm:subscriptionType>
        <alm:creationDate>2012-12-24T16:18:46.890+02:00</alm:creationDate>
        <alm:startDate>2012-12-01T16:18:46.890+02:00</alm:startDate>
        <alm:endDate>2012-12-25T16:18:46.891+02:00</alm:endDate>
        <alm:level>2</alm:level>
        <alm:subscriber>
            <person id="4"/>
            <alarmChannelTypes>
                <warnBy id="1"/>
                <warnBy id="2"/>
            </alarmChannelTypes>
        </alm:subscriber>
        <alm:focus>
            <jobs>
                <job id="2" depth="26"/>
                <job id="7" depth="26"/>
            </jobs>
        </alm:focus>
        <alm:caseManagement>
            <stateManagement>
                <state-types:LiveStateInfo LSIDateTime="2012-12-24T16:18:46.891+0200">
                    <state-types:StateName>PENDING</state-types:StateName>
                    <state-types:SubstateName>CREATED</state-types:SubstateName>
                    <state-types:StatusName>SUCCESS</state-types:StatusName>
                </state-types:LiveStateInfo>
            </stateManagement>
            <timeManagement>
                <timeOutControl>false</timeOutControl>
                <tolerancePercentage>false</tolerancePercentage>
                <minPercentage>true</minPercentage>
            </timeManagement>
        </alm:caseManagement>
    </alarm>
    <alarm xmlns="http://www.likyateknoloji.com/XML_alarm_types" ID="136">
        <alm:name>Alarm9</alm:name>
        <alm:desc>Alarm99</alm:desc>
        <alm:alarmType>Job</alm:alarmType>
        <alm:subscriptionType>User</alm:subscriptionType>
        <alm:creationDate>2012-12-24T16:24:26.666+02:00</alm:creationDate>
        <alm:startDate>2012-12-02T16:24:26.666+02:00</alm:startDate>
        <alm:endDate>2012-12-25T16:24:26.666+02:00</alm:endDate>
        <alm:level>1</alm:level>
        <alm:subscriber>
            <person id="1"/>
            <alarmChannelTypes>
                <warnBy id="1"/>
            </alarmChannelTypes>
        </alm:subscriber>
        <alm:focus>
            <jobs>
                <job id="2" depth="32"/>
            </jobs>
        </alm:focus>
        <alm:caseManagement>
            <stateManagement>
                <state-types:LiveStateInfo LSIDateTime="2012-12-24T16:24:26.667+0200">
                    <state-types:StateName>PENDING</state-types:StateName>
                    <state-types:SubstateName>CREATED</state-types:SubstateName>
                    <state-types:StatusName>SUCCESS</state-types:StatusName>
                </state-types:LiveStateInfo>
            </stateManagement>
            <timeManagement>
                <timeOutControl>false</timeOutControl>
                <tolerancePercentage>false</tolerancePercentage>
                <minPercentage>true</minPercentage>
            </timeManagement>
        </alm:caseManagement>
    </alarm>
</alm:alarmManagement>